Hotel JK Regency,"30, Old Nagardas Road, Pump House Subway, W.E.Highway, Near Sai Service. Andheri (E), 400069, India", Near Sai Service. Andheri (E),2.5,"Room Service, Free Parking, Free Breakfast, Free High Speed Internet ( WiFi )",2221,4134,5.687873684,5.501193056,36,4,12,20,0,"['manager suresh babu is very helpful and full of warmth', 'rooms are well furnished and neat and clean', 'booking front office is excellent', 'i stayed here with my friends and our stay was comfortable one']","['also pretty close to the andheri railway station', 'they say that they', 'airport transfervery good', 'even the', 'i can say this has become a frequent destination for me for short business trips', 'provide pick up and drop on request', 'reception good , waitersstwardsgood , breakfast inclusive and ok', 'in their own eeco car', 'the vehicle was good new purchase and the driver was courteous and good', 'they tried every possible way to ensure that we enjoyed our short stay', 'the rooms were clean and hygienic', 'it was not up to the mark']","['the staff didnt bother to change the used bedcover and blanket untill we shouted at them', 'dont book even if you get it for free', 'the rooms offered were extremely congested , small , suffocating , dirty and stinking', 'the overall room decor was too loud , and not up to the mark of a decent hotel', 'i stayed there for days', 'room service is not much good', 'better to have something else from outside or from there restaurent', 'pethatic food , the staff were like tentwalas', 'stayed at jk regency for a couple of days', 'the only', 'i had gone for an event at bombay exhibition center', 'but not advisable if travelling with family or friends', 'my wife was tearful on leaving because of the warm hospitality and kindness shown by all', 'room services were on time', 'the view of the city from the room was not appreciable', 'all varieties are served and in both veg and non veg category', 'not so overwhelming', 'rooms were clean , but lighting not working and fitments were not proper', 'even when i asked for complain book , manager say we dont maintain the complain book , you can write a note on plain piece of paper', 'rooms were clean , but lighting not working and fitments were not proper']",[],5.51405,1,0,1,0,0,[],['the view of the city from the room was not appreciable'],[],[],5.2688275,10,0,6,3,1,[],"['the rooms offered were extremely congested , small , suffocating , dirty and stinking', 'the rooms were clean and hygienic', 'the view of the city from the room was not appreciable', 'rooms are well furnished and neat and clean', 'rooms were clean , but lighting not working and fitments were not proper', 'rooms were clean , but lighting not working and fitments were not proper']","['the overall room decor was too loud , and not up to the mark of a decent hotel', 'room service is not much good', 'room services were on time']",['the staff didnt bother to change the used bedcover and blanket untill we shouted at them'],6.0027625,2,0,2,0,0,[],"['pethatic food , the staff were like tentwalas', 'reception good , waitersstwardsgood , breakfast inclusive and ok']",[],[],5.56696,5,0,4,1,0,[],"['the staff didnt bother to change the used bedcover and blanket untill we shouted at them', 'room service is not much good', 'pethatic food , the staff were like tentwalas', 'reception good , waitersstwardsgood , breakfast inclusive and ok']",['room services were on time'],[],5.82956,5,1,3,1,0,['rooms are well furnished and neat and clean'],"['the rooms were clean and hygienic', 'rooms were clean , but lighting not working and fitments were not proper', 'rooms were clean , but lighting not working and fitments were not proper']","['the rooms offered were extremely congested , small , suffocating , dirty and stinking']",[],111,33
Hotel Royal Park,"Patel Complex, opp Johnson and Johnson, Safed Pool, Andheri Kurla Road, Sakinaka, 400 072, India", Sakinaka,2.5,"Budget, Free Parking, Free Breakfast, Room Service, Free Parking, Restaurant, Free Breakfast, Free High Speed Internet ( WiFi )",2468,4010,5.698210714,5.521562931,29,0,13,15,1,[],"['it provides lot of variety in reasonable amount', 'room service is also fast', 'very nice play to stay and conduct your work', 'will definitely stay when', 'the hotel per say is okay , nice rooms , spacious , bathrooms spacious , sleep quality good', 'rooms are clean too', 'checkin and checkout was faster', 'good for transit passengers as it is very near the airport', 'for the kind of rates , it is value for money and if n transit , it is a good halting point', 'location of the hotel was good', 'infrastructure of building was good', 'staff behaviour in that hotel was also good', 'overall experience was good']","['however i took lot', 'the saki naka metro is closeby a few kms and plenty of autos available nearby', 'during my last trip to mumbai in october , i stayed here', 'i would have definitely given a higher rating , but the plumbing was quite sad', 'the check in and check out was done in a jiffy and there was no hassle in luggage assistance too', 'what', 'i stayed here before once , but while booking this time i didnt realized its the same one', 'the rooms are tiny but was clean and tidy', 'the service at the hotel was prompt and courteous', 'they were helpful in their ways too', 'the locale is in the midst of a neighborhood that leaves much to be desired', 'we were booking through corporate so there was no difficulty', 'i went there alone for official purpose in april', 'no improvement is needed there', 'they gave me discount as well since i went there again']",['worst experience no worst experience'],5.543975,1,0,1,0,0,[],['location of the hotel was good'],[],[],5.90818125,4,0,3,1,0,[],"['the hotel per say is okay , nice rooms , spacious , bathrooms spacious , sleep quality good', 'rooms are clean too', 'the rooms are tiny but was clean and tidy']",['room service is also fast'],[],NA,0,0,0,0,0,[],[],[],[],5.541925,3,0,2,1,0,[],"['room service is also fast', 'the service at the hotel was prompt and courteous']",['staff behaviour in that hotel was also good'],[],5.706775,2,0,1,1,0,[],['rooms are clean too'],['the rooms are tiny but was clean and tidy'],[],81,43
Dragonfly Hotel,"New Chakala Link Road, At the Dr. Charat Singh Colony Signal, Near Solitaire Corporate Park, Chakala, Andheri(East), 400093, India", Andheri(East),2.5,"Room Service, Restaurant, Free High Speed Internet ( WiFi )",3825,9378,5.707338542,5.496944737,38,3,15,19,1,"['the service is good and the rooms are basic but spacious', 'i had a comfortable stay and will recommend my colleagues and office to book me for next time', 'overall a very good experience']","['the breakfast spread could be better but rooms are spacious with lots of natural light', 'we stayed there while on a meeting to our ho', 'i stayed here just a few weeks ago', 'it is a little gem', 'i felt it was value for money', 'the good part is its on the main road and close to airport', 'not so great', 'we stayed for nights', 'mr', 'mr', 'they did finally offer us a good rate when we entered into a corporate tieup with them', 'service provided was very nice and the food was just too good', 'over and above good value for money', 'were in working condition', 'the cocoon restaurant food was awesome , service was fast and excellent']","['breakfast was an average and there is no recreational facilities like', 'the hotel concierge is very helpful and the breakfast is alright', 'hardly a rupee auto ride from the', 'the lobby is unimpressive', 'the farbic of the towel', 'but noisy because in the morning in this street a lot of traffic jams', 'sunil dos was very helpful to arrange our booking', 'com', 'even though it is situated on the main', 'i stayed from th december till nd jan and went to shirdi and trimbakeshwar on the nd', 'i am sure no one will regret their decision', 'the only point of concern is their fluctuating rates and you never know what determines the huge fluctuations', 'at times they are priced more than star properties', 'the ambiance of the hotel was pretty impressive and staff members were helpful and cooperative', 'hotel staff is also very helpful', 'i stayed there in july', 'i am from delhi', 'i went there single for work', 'query was cleared instantly']","['we asked some driver for take a tour for mumbai , and this driver was really rude']",NA,0,0,0,0,0,[],[],[],[],5.522466667,3,0,2,1,0,[],"['the breakfast spread could be better but rooms are spacious with lots of natural light', 'the service is good and the rooms are basic but spacious']",['breakfast was an average and there is no recreational facilities like'],[],5.582845,5,0,4,1,0,[],"['the breakfast spread could be better but rooms are spacious with lots of natural light', 'breakfast was an average and there is no recreational facilities like', 'service provided was very nice and the food was just too good', 'the cocoon restaurant food was awesome , service was fast and excellent']",['the hotel concierge is very helpful and the breakfast is alright'],[],6.44212,5,2,2,1,0,"['the service is good and the rooms are basic but spacious', 'the cocoon restaurant food was awesome , service was fast and excellent']","['service provided was very nice and the food was just too good', 'hotel staff is also very helpful']",['the ambiance of the hotel was pretty impressive and staff members were helpful and cooperative'],[],NA,0,0,0,0,0,[],[],[],[],115,38
Blue Orchids Executive,"Rustom Market, AG Link Road, Sakinaka, 400072, India", Sakinaka,3,"Room Service, Free High Speed Internet ( WiFi )",1666,2344,5.73325,5.538794048,42,5,14,22,1,"['the moment when we entered the hotel was amazing , very impressive receptionist , explained everything to us in a pleasant way', 'amenities provided was very good', 'rooms are clean , my advice to traveller is you can stay here and enjoy your visit to mumbai', 'wifi service is also available in all the rooms which is good', 'also , security arrangements are good']","['well i paid the price and got the blues for it', 'we shouted from inside telling the person that people are inside and not to open it', 'room is clean and are small in size but you get what you pay', 'rooms are very tiny but they tried to keep it clean', 'as they', 'one of my relative who lives in pune suggested us to stay at blue orchids executive', 'free wifi provided was really and its very fast', 'rooms are very tiny but they tried to keep it clean', 'hotel location was nice', 'rooms were neat , clean , and well maintained', 'mumbai as tourist destination is fine', 'it was value for money paid', 'amenities provided are good', 'this hotel provides all the services at a reasonable price']","['i had to travel to mumbai this month on business trip for couple of days', 'the rooms are too small , nothing like it looks on site', 'location is very bad and there are local labourers stalking at u right outside the hotel', 'plz avoid family', 'if u want to stay in andheri east so u can stay in nlue orchids only it was nice stay like a home and', 'it is totally not worthy of single penny paid', 'the rooms were super tiny and was totally unclean', 'not recommended', 'near saki naka metro was one of big advantage', 'would stay again of required at this budget', 'i wanted to visit mumbai for a college trip', 'in short , everything was really up to the mark and worth the price', 'i was staying in blue orchids executive for days for my business trip in last month', 'better to negotiate so that you do not feel bad as compare to the price paid', 'when i traveled at mumbai then i stayed in blue orchids executive', 'i went there in my own vehicle', 'location of the hotel was very convenient for me', 'whenever you required anything , they served you quickly', 'checkin and checkout process was not delayed', 'i went there alone in the month of may for official visit', 'i would like to stay there for more days in my next visit', 'i had met bad experience while staying there']","['the locality was not good , water facility was not good and the roof height was very short']",4.370335,5,0,2,3,0,[],"['location of the hotel was very convenient for me', 'hotel location was nice']","['the rooms are too small , nothing like it looks on site', 'location is very bad and there are local labourers stalking at u right outside the hotel', 'the locality was not good , water facility was not good and the roof height was very short']",[],5.550830556,9,0,7,2,0,[],"['the rooms are too small , nothing like it looks on site', 'the rooms were super tiny and was totally unclean', 'rooms are very tiny but they tried to keep it clean', 'rooms are very tiny but they tried to keep it clean', 'rooms were neat , clean , and well maintained', 'rooms are clean , my advice to traveller is you can stay here and enjoy your visit to mumbai', 'wifi service is also available in all the rooms which is good']","['room is clean and are small in size but you get what you pay', 'the locality was not good , water facility was not good and the roof height was very short']",[],NA,0,0,0,0,0,[],[],[],[],7.147,3,1,2,0,0,"['the moment when we entered the hotel was amazing , very impressive receptionist , explained everything to us in a pleasant way']","['wifi service is also available in all the rooms which is good', 'this hotel provides all the services at a reasonable price']",[],[],6.556658333,6,1,4,1,0,"['rooms are clean , my advice to traveller is you can stay here and enjoy your visit to mumbai']","['room is clean and are small in size but you get what you pay', 'rooms are very tiny but they tried to keep it clean', 'rooms are very tiny but they tried to keep it clean', 'rooms were neat , clean , and well maintained']",['the rooms were super tiny and was totally unclean'],[],94,48
Hotel Bliss Comfort,"A/3, Opp. Seven Hills Hospital, Next to Shahana Medical, Marol Maroshi Road, Marol, Andheri (E), 400059, India", Andheri (E),2.5,"Room Service, Free Parking, Free High Speed Internet ( WiFi )",987,1727,5.772015909,5.474354,25,1,9,15,0,['hotels accommodation is good'],"['its a lodge', 'my package inculded breakfast', 'hotel staff is good', 'bending as we could', 'the wifi was good', 'the first night my wife', 'overall good', 'overall good', 'best experience sea near haji ali dargah']","['strict no is travelling with family or ladies', 'dont fall for closer to airport tag', 'the pictures are just to fool', 'i stayed there two times and my experience was not bad', 'overall vicinity is ok', 'its like a slum building where they have just painted and fitted the interiors', 'the outside walls', 'so we were taking showers from the tap below the shower', 'it also smelled very bad , cigar or else', 'com', 'when we ended up there it was pathetic', 'the paint was falling off the walls', 'there is no such thing as hygiene in india', 'the owner is from kerala', 'it was good and i wish to visit bombay again']",[],NA,0,0,0,0,0,[],[],[],[],5.8645,2,0,2,0,0,[],"['my package inculded breakfast', 'hotels accommodation is good']",[],[],5.51215,1,0,1,0,0,[],['my package inculded breakfast'],[],[],5.58505,1,0,1,0,0,[],['hotel staff is good'],[],[],NA,0,0,0,0,0,[],[],[],[],70,5
The Leela Mumbai,"Sahar, 400 059, India",Sahar,5,"Room Service, Pool, Free Parking, Restaurant, Fitness Centre with Gym / Workout Room, Bar/Lounge, Spa",8946,17830,5.902650781,5.779239062,48,8,19,20,1,"['amazing hotel with fabulous rooms and gardens', 'stayed here in june for days and quite liked the stay', 'it is so beautiful , you can forget that you are living in the slums of mumbai , this one all over the city', 'it was a great experience with leela', 'food is also good and very nice view', 'i had enjoyed my time here', 'location of the hotel was very good', 'interior was also very nice']","['it has carved a name for itself from the start', 'its starting to show its age , e', 'g', 'they took their time for their approvals', 'the hotel has a nice architecture and the restaurants are good serving multi cuisines', 'conveniently located close to the airport', 'the service is quick and the staff are accommodating', 'enjoying a drink by the', 'lobby and pool are welldecorated well , very indian flavor', 'and best thing is that its near by airport', 'will try again', 'i stayed there for days with family', 'i liked it very much', 'look wise , it was excellent', 'hotel staff behaviour was very good', 'they were quick in response on calling', 'services were fully satisfactory', 'rooms were well maintained , neat and tidy', 'must recommend for any business traveller']","['the reception and rooms were very attractively decorated and the staff were very polite', 'in the rather dated bathroom fittings but to me thats a small price to pay for the excellent staff and', 'we stayed at the leela at the end of a month long trip to india', 'we wanted somewhere near the airport as our flight home was very early in the morning', 'however the leela , with its beautiful gardens , didnt feel', 'checkin was smooth , but checkout experience is not that great', 'spent a night in the leela mumbai and was very satisfied', 'got upgraded to a suite without asking , clearly they know how to sweeten your stay', 'perhaps thats why i found the airport drop off literarily minutes a', 'the pool is very relaxing with a large cascading waterfall', 'hotel location is not very good , in urban and suburban halfway', 'hotel staff was attentive and very courteous', 'there was no delay at the time of checkin and checkout', 'many varieties were available there', 'no improvement is needed there', 'i went there for business meeting in january month', 'both varieties were available like veg and nonveg', 'food cost was reasonable according to the payment', 'the food for the buffet was well spread out , but felt the taste was lacking', 'the checkin and checkout process was smooth and very prompt']","['the only slight downsides were the fact that the bar sold no draft beer and the stuff in bottles was horribly expensive , and the hotel dont like you taking photographs inside']",6.702166667,3,1,2,0,0,['food is also good and very nice view'],"['hotel location is not very good , in urban and suburban halfway', 'location of the hotel was very good']",[],[],5.0480625,8,0,4,3,1,[],"['the reception and rooms were very attractively decorated and the staff were very polite', 'amazing hotel with fabulous rooms and gardens', 'services were fully satisfactory', 'rooms were well maintained , neat and tidy']","['in the rather dated bathroom fittings but to me thats a small price to pay for the excellent staff and', 'food cost was reasonable according to the payment', 'the food for the buffet was well spread out , but felt the taste was lacking']","['the only slight downsides were the fact that the bar sold no draft beer and the stuff in bottles was horribly expensive , and the hotel dont like you taking photographs inside']",5.79595625,4,0,4,0,0,[],"['the hotel has a nice architecture and the restaurants are good serving multi cuisines', 'food is also good and very nice view', 'food cost was reasonable according to the payment', 'the food for the buffet was well spread out , but felt the taste was lacking']",[],[],5.562479167,6,0,3,3,0,[],"['the reception and rooms were very attractively decorated and the staff were very polite', 'the service is quick and the staff are accommodating', 'hotel staff was attentive and very courteous']","['in the rather dated bathroom fittings but to me thats a small price to pay for the excellent staff and', 'hotel staff behaviour was very good', 'services were fully satisfactory']",[],6.510475,1,0,1,0,0,[],"['rooms were well maintained , neat and tidy']",[],[],125,13
The Orchid,"70 C Nehru Road, Vile Parle East, Vile Parle East, 400099, India", Vile Parle East,4.5,"Pool, Free Parking, Fitness Centre with Gym / Workout Room, Room Service, Restaurant, Bar/Lounge, Free Internet, Free Breakfast",6354,11598,5.939189423,5.580808621,29,5,7,14,3,"['awesome food and excellent staff', 'overall a very good experience', 'overall the food is great , ambiance is spot on but some things do need to be patched up', 'the room are very clean and good', 'the interiors are also very good']","['very close to both the domestic and international terminals', 'the room was very comfortable and as we had checked in around noon they were serving lunch and not breakfast', 'the service and rooms are good', 'best feature of this hotel is its location which is very near the airport making it convenient for short business trips to mumbai', 'overall a', 'highly recommended for travelers', 'the overall experience is good and can be advised to visit there']","['despite this i', 'their plumbing system is archaic', 'the tiles are chipped', 'overall , it was a terrible experience', 'sleep quality is great and swimming pool helps you recover the jet lag', 'the staff were very helpful and kept my fragrant bag full of cheese in the hotel frig', 'there are some pros and cons to the orchid', 'but make sure you prebook in order to have your name on the list', 'my agent had not secured the booking , but', 'in fact it is located almost within the airport campus and thus you spend minimum time travelling to and from the hotel , which is especially helpful if you have a late night arrival or early morning departure', 'i was there on th oct to th oct with my kids', 'the domestic airport is minutes away while the international is minutes away', 'i had been put up in the orchid as my flight was delayed by a day', 'the roof top swimming pool is small and cramped and does not score full points']","['very useful for business trips , when you can check in after your flight and go ahead for your work without losing much time and also when you have to catch early morning flights', 'only negative from my side are seprate wifi charges which is an inconveienince', 'the breakfast buffet was terrible , the staff impolite least interested in attending to patrons']",5.48335,2,0,1,1,0,[],"['overall the food is great , ambiance is spot on but some things do need to be patched up']",['best feature of this hotel is its location which is very near the airport making it convenient for short business trips to mumbai'],[],5.48515,4,0,2,2,0,[],"['the service and rooms are good', 'in fact it is located almost within the airport campus and thus you spend minimum time travelling to and from the hotel , which is especially helpful if you have a late night arrival or early morning departure']","['the room was very comfortable and as we had checked in around noon they were serving lunch and not breakfast', 'the room are very clean and good']",[],6.73094375,4,1,3,0,0,"['overall the food is great , ambiance is spot on but some things do need to be patched up']","['the room was very comfortable and as we had checked in around noon they were serving lunch and not breakfast', 'the breakfast buffet was terrible , the staff impolite least interested in attending to patrons', 'awesome food and excellent staff']",[],[],5.5396625,4,0,3,0,1,[],"['the service and rooms are good', 'the staff were very helpful and kept my fragrant bag full of cheese in the hotel frig', 'awesome food and excellent staff']",[],"['the breakfast buffet was terrible , the staff impolite least interested in attending to patrons']",8.44515,1,1,0,0,0,['the room are very clean and good'],[],[],[],88,18
Hotel Samraj,"Chakala Road, 400099, India",Chakala Road,2,"Room Service, Free Parking, Restaurant, Free Breakfast, Free High Speed Internet ( WiFi )",2468,3023,5.986135,5.832123913,23,1,13,8,1,['overall it was a pleasant stay'],"['room service was good', 'airport pickupdrop is available', 'very easy find as it is on main road', 'room service are normal', 'friendly online booking system', 'hotel service before and after was good', 'will give marks on to scale', 'comfortable and safe to stay', 'better go outside to eat', 'charged extra taxes and other extra rates on the rate confirmed while booking', 'i dont recommend at all', 'hotel service before and after was good', 'has been maintained well , just that the corridors and interiors need to be upgraded so that clients or visitors feel superior']","['stayed there for couple of days in nov on a business trip with my colleague', 'i did not ask for wifi , so no comment on that', 'i have stayed there for days', 'it also near to solitaire corporate park', 'airport pickup n drop was at right time arranged', 'no transportation nearby for almost half a km', 'not at', 'staff is polite helpful excellant location afforable prices']",['bathroom also very much ugly and dirty'],5.15565,1,0,0,1,0,[],[],['staff is polite helpful excellant location afforable prices'],[],5.505858333,3,0,1,2,0,[],['bathroom also very much ugly and dirty'],"['room service was good', 'room service are normal']",[],NA,0,0,0,0,0,[],[],[],[],5.53375,5,0,5,0,0,[],"['room service was good', 'room service are normal', 'hotel service before and after was good', 'staff is polite helpful excellant location afforable prices', 'hotel service before and after was good']",[],[],2.581425,1,0,0,0,1,[],[],[],['bathroom also very much ugly and dirty'],53,57
