Sai Palace Hotel,"Mahakali Caves Road, 400093, India",Mahakali Caves Road,3.5,"Restaurant, Room Service, Fitness Centre with Gym / Workout Room, Free Parking, Free Internet, Bar/Lounge, Free Breakfast",5182,6725,6.595584524,5.849146795,39,9,9,20,1,"['authentic flavours and great taste', 'the ambience was very nice and the decor was quite nice', 'hotel rooms are excellent , airey', 'the overall experience was very good', 'the food is excellent with cooperative staff', 'hygiene rating as the hotel is very good and above all it offers transportation to the service airport and all for free', 'it was very fast and good', 'a nice experience', 'also interior was very good']","['definitely it will be my first preference in my next visit', 'they even had', 'they serve the starters in the table', 'the', 'other items were good', 'the location of the hotel was very convenient', 'it is very good for business visits also', 'i liked it', 'arrangement for all customers was good']","['it was located near to airport on just mints drive', 'below average gym with just a treadmill', 'just ok , not very spread', 'the last time i was there', 'quite few starters mostly non veg and few veg', 'firstly there were no one to take your car , you have to search for someone here and there', 'peak traffic hours between to pm could be a nightmare though and the timings unpredictable', 'i have stayed here on several occasions with family and with business associates', 'the location is next to the holy family church at mahakali andheri and very convinient to reach', 'there was no delay during the check in and check out procedure', 'the basic amenities like a', 'c , t', 'it valued for the money', 'the hotel is located some kms from the hotel , but hotel provides escort services', 'the staff of the hotel was friendly and supportive , while the overall experience was value for money', 'the checkin and checkout were done without any hassle', 'we have stayed here couple of times', 'sai palace is in andheri east and i had lunch there it provided very tasty food', 'reception and hotel people were very helpful', 'its very near to andheri station']",['the worst experience was with the valet'],5.526325,2,0,2,0,0,[],"['the location is next to the holy family church at mahakali andheri and very convinient to reach', 'the location of the hotel was very convenient']",[],[],5.057766667,3,0,2,1,0,[],"['hotel rooms are excellent , airey', 'sai palace is in andheri east and i had lunch there it provided very tasty food']",['the location is next to the holy family church at mahakali andheri and very convinient to reach'],[],5.576775,2,0,2,0,0,[],"['the food is excellent with cooperative staff', 'sai palace is in andheri east and i had lunch there it provided very tasty food']",[],[],6.96710625,4,2,2,0,0,"['the food is excellent with cooperative staff', 'hygiene rating as the hotel is very good and above all it offers transportation to the service airport and all for free']","['the staff of the hotel was friendly and supportive , while the overall experience was value for money', 'reception and hotel people were very helpful']",[],[],NA,0,0,0,0,0,[],[],[],[],122,13
Hotel Transit,"Nehru Road Extn, Near Domestic Airport, Vile Parle East, 400099, India", Vile Parle East,3,"Restaurant, Room Service, Free Parking, Bar/Lounge, Free Breakfast, Free Internet",3763,7403,6.632852857,5.946403774,53,8,23,21,1,"['room service is good', 'lifts are conventional type and can be improved', 'rooms are neat and clean', 'size is also good', 'the food provided in the hotel is very good', 'look wise it was beautiful from outside and inside', 'the food was very much delicious and the service was very good', 'the hotel was very much clean and overall it was a good experience']","['i will', 'overall good value for money', 'the hotel was clean', 'good for transit passengers who have to catch flights in odd hours', 'rooms and toilets were clean and up to the expectations', 'i was satisfied with the stay', 'pros', 'the rooms are well maintained and neat', 'the property is close to the airport and service was outstanding', 'rooms are clean and large', 'highly recommended for visitors to mumbai', 'half day or a day', 'very close to the airport', 'doesnt look that good from the outside but well maintained', 'checkin and checkout was smooth', 'it is about meter away from airport', 'rs', 'bathroom was also neat and clean', 'food was tasty in this hotel', 'i went there with family', 'sightseeing trip was arranged by the hotel', 'the staff seemed to be very hard working and the room was very much good', 'hotels rooms are deluxe type and hospitality is good']","['we chose because it is near to the airport and so we could save on time and money spent in taxi', 'hotel was accommodating enough', 'it was a value for money', 'in addition nearness to the airport was its usp', 'very near to domestic airport walking distance', 'airport pickup is prompt', 'overall , i got less time but my experience was good', 'i stayed just for night as i had to catch the flight next day', 'cons', 'though it is very close to airport , the noise was not much noticed', 'the guest is taken care properly', 'arrived early morning into mumbai they had a car and airport representative to pick me up', 'its not at all comfortable for long stay', 'one may stay over here for short trip i', 'e', 'rooms are clean but the yellow lights in the rooms are irritating', 'they do not have white lights', 'i went there in august of this year', 'value of money paid', 'food and attending facilities is not much good', 'hotels position is so much clumsy and not in good position']","['tv , ac , coffee maker , tea maker , and heater were available in this hotel']",5.856558333,3,0,3,0,0,[],"['the property is close to the airport and service was outstanding', 'sightseeing trip was arranged by the hotel', 'hotels position is so much clumsy and not in good position']",[],[],5.5384375,12,1,8,2,1,['the staff seemed to be very hard working and the room was very much good'],"['rooms and toilets were clean and up to the expectations', 'rooms are neat and clean', 'the rooms are well maintained and neat', 'rooms are clean and large', 'rooms are clean but the yellow lights in the rooms are irritating', 'bathroom was also neat and clean', 'food and attending facilities is not much good', 'hotels rooms are deluxe type and hospitality is good']","['hotel was accommodating enough', 'room service is good']","['tv , ac , coffee maker , tea maker , and heater were available in this hotel']",6.150075,4,1,3,0,0,['the food was very much delicious and the service was very good'],"['the food provided in the hotel is very good', 'food was tasty in this hotel', 'food and attending facilities is not much good']",[],[],6.64848125,4,1,3,0,0,['the food was very much delicious and the service was very good'],"['room service is good', 'the property is close to the airport and service was outstanding', 'the staff seemed to be very hard working and the room was very much good']",[],[],7.05715,8,3,5,0,0,"['rooms are neat and clean', 'bathroom was also neat and clean', 'the hotel was very much clean and overall it was a good experience']","['the hotel was clean', 'rooms and toilets were clean and up to the expectations', 'the rooms are well maintained and neat', 'rooms are clean and large', 'rooms are clean but the yellow lights in the rooms are irritating']",[],[],113,24
Hotel Sunshine,"Western Express Highway, Near Dahisar Check Naka, 401 107, India", Near Dahisar Check Naka,NA,Room Service,NA,NA,6.649198333,5.705675,26,2,12,11,1,"['hotel is good and food quality is excellent', 'location was nice but the room is very small and sophisticated']","['i had a booking for rd nov for one day', 'and he keep on on arguments', 'next day when i check out', 'we', 'restaurant n bar is clean n good', 'prices are reasonable', 'room is properly cleaned', 'when i came here first time i found some improperness but the next time i thank for the care they have taken during our stay and i salute your co operation', 'hotel staff was good in behaviour and friendly', 'room was neat , clean , and proper maintained', 'thanks for the care you have taken during our stay and i salute your cooperation', 'whenever i come i will definitely stay in your lovely abode']","['and requested for earlier check in for', 'am and they denied', 'once i check in around', 'pm the reception guy rudely informed , we reserved a room for you since morning and need to pay for one more day', 'the wifi is free for hours and then charged', 'i hated my one night stay there', 'their rates are not fixed', 'u can always find some or the other mode of transportation', 'hotel was located near to the city and i reached there easily', 'no activities were arranged by the hotel', 'parking facility was provided by the hotel']",['i just stayed one night and was dead tired'],5.543975,1,0,1,0,0,[],['location was nice but the room is very small and sophisticated'],[],[],5.660928571,7,1,1,5,0,['location was nice but the room is very small and sophisticated'],"['pm the reception guy rudely informed , we reserved a room for you since morning and need to pay for one more day']","['room is properly cleaned', 'hotel was located near to the city and i reached there easily', 'room was neat , clean , and proper maintained', 'no activities were arranged by the hotel', 'parking facility was provided by the hotel']",[],7.4341625,2,1,1,0,0,['hotel is good and food quality is excellent'],['restaurant n bar is clean n good'],[],[],5.4547125,2,0,1,1,0,[],['hotel staff was good in behaviour and friendly'],"['pm the reception guy rudely informed , we reserved a room for you since morning and need to pay for one more day']",[],7.165666667,3,1,2,0,0,['restaurant n bar is clean n good'],"['room is properly cleaned', 'room was neat , clean , and proper maintained']",[],[],61,48
Hotel Jayshree,"197, Dayaldas Road Opposite Domestic Airport, Vile-Parle, 400057, India", Vile-Parle,NA,"Vile Parle East, Room Service, Restaurant, Bar/Lounge, Free Parking",3085,4195,6.768484091,5.895221,25,4,9,11,1,"['excellent and fable customer orientation', 'wonderful ambience and ground to earth people to assit you', 'the hotel weather is so nice or fresh', 'best experience everything was nice']","['small lift', 'add to that a very reason able price', 'best of all a free transport for pickup and drop from the airports', 'overall a decent stay', 'otherwise the stay was fine', 'but working', 'recommended for people who visit mumbai for a day or so', 'amenities are upto mark', 'overall experience was nice']","['toilets were clean but attantion to details were missing', 'i often visit mumbai', 'the hotel is across the road from the domestic airport , and next to the western express highway which is very handy', 'indeed a fable experience to come over here', 'i went there to visit my friends', 'i asked for the wifi password but did not receive any', 'as there wasnt', 'was on an official visit to mumbai by flight', 't', 'can not feel as if you are away from', 'very near to airport']",['worst experience nothing'],NA,0,0,0,0,0,[],[],[],[],5.1182875,2,0,1,1,0,[],['toilets were clean but attantion to details were missing'],"['the hotel is across the road from the domestic airport , and next to the western express highway which is very handy']",[],NA,0,0,0,0,0,[],[],[],[],NA,0,0,0,0,0,[],[],[],[],6.597925,2,1,0,1,0,['the hotel weather is so nice or fresh'],[],['toilets were clean but attantion to details were missing'],[],71,54
Hyatt Regency Mumbai,"Sahar Airport Road, Andheri East, 400099, India", Andheri East,5,"Vile Parle East, Free Breakfast, Luxury, Pool, Pool, Fitness Centre with Gym / Workout Room, Room Service, Restaurant, Free Parking, Bar/Lounge, Free Breakfast, Spa",8575,14313,6.776391935,6.212165341,44,6,26,12,0,"['the hotel is beautifully appointed and the rooms are very comfortable', 'food was great and the services well delivered', 'service is good and polite , and reception area is pretty remarkable', 'food was great to have and i loved its fresh taste and authentic flavours', 'you are welcomed with warm smiles , the front office is huge , gives a feel of luxury', 'but for a business traveller , it does an excellent job']","['the venue is nice and the rooms are spacieuse', 'located right at the mumbai international airport , it is a quick trip to and from the hotel and the hotel provides a car service', 'very comfy', 'probably the best in india', 'breakfast layout is awesome and the best part is andheri , bandra is all near to this hotel', 'looking forward to stay again', 'g', 'i stayed there new years eve', 'the security is high', 'stayed here for one night while on a business trip', 'very close to the airport', 'km', 'my super favorite thing about this hotel is the bathroom has a bathtub', 'the selection of food available is fantastic as well with cheese , fruit , traditional indian and western snacks', 'the pool side is also lovely in the evening and perfect to sit down for a drink', 'so overall a pretty good deal', 'definitely staying here again on my next triphad a great time there', 'the location was something which attracted us', 'the location of the hotel is its biggest advantage', 'food and beverage services are also fine', 'the overall experience was good', 'i would recommend this to people on short trips', 'the view from the room was fantastic , the swimming pool and the newly built flyovers', 'yet its so calm inside', 'cleanliness was awesome inside the hotel', 'from the checkin to checkout i was feeling pleasure to live there']","['so to recomand if just to sleep well between flights', 'we spent the night here while in transit to chennai', 'i would stay here again for', 'transport to the airport complimentary', 'the property is huge took me almost five minutes to walk to my room', 'the open showers and the difficult', 'this hyatt is like an oasis in the slums around the airport', 'offered oneway complimentary airport transfer', 'room service did not take too much time', 'you will probably not insensitive to square kilometers multicolored granite floors and walls of the entrance hall', 'do not confuse it with grand hyatt', 'ive stayed at hyatt regency mumbai multiple times for the main reason being that its extremely close to the airport']",[],5.93711,5,0,5,0,0,[],"['the venue is nice and the rooms are spacieuse', 'the property is huge took me almost five minutes to walk to my room', 'the location was something which attracted us', 'the location of the hotel is its biggest advantage', 'the view from the room was fantastic , the swimming pool and the newly built flyovers']",[],[],5.824125,8,0,5,3,0,[],"['the venue is nice and the rooms are spacieuse', 'the hotel is beautifully appointed and the rooms are very comfortable', 'my super favorite thing about this hotel is the bathroom has a bathtub', 'the selection of food available is fantastic as well with cheese , fruit , traditional indian and western snacks', 'the location was something which attracted us']","['the property is huge took me almost five minutes to walk to my room', 'room service did not take too much time', 'the view from the room was fantastic , the swimming pool and the newly built flyovers']",[],5.72291,5,0,5,0,0,[],"['breakfast layout is awesome and the best part is andheri , bandra is all near to this hotel', 'food was great and the services well delivered', 'the selection of food available is fantastic as well with cheese , fruit , traditional indian and western snacks', 'food and beverage services are also fine', 'food was great to have and i loved its fresh taste and authentic flavours']",[],[],6.665835,5,2,3,0,0,"['food was great and the services well delivered', 'service is good and polite , and reception area is pretty remarkable']","['located right at the mumbai international airport , it is a quick trip to and from the hotel and the hotel provides a car service', 'room service did not take too much time', 'food and beverage services are also fine']",[],[],6.9725125,2,1,1,0,0,['food was great to have and i loved its fresh taste and authentic flavours'],['cleanliness was awesome inside the hotel'],[],[],110,26
Sahara Star,"Mumbai Domestic Airport, Vile Parle (East), 400 099, India", Vile Parle (East),5,"Vile Parle East, Luxury, Free Parking, Free Parking, Fitness Centre with Gym / Workout Room, Room Service, Restaurant, Free Internet, Bar/Lounge, Spa",7773,10611,6.783345313,5.790305128,39,2,21,16,0,"['rooms are very good and room service is also quick', 'my experience was really good']","['we', 'especially that i had', 'let us see if they will finish one day advantage gut rates available', 'remote', 'what is great is the balcony overlooking the atrium where one can smoke', 'they offer free pick up and', 'the rooms are renovated , the decor is exemplary , and the best part this hotel excels is in its hospitality', 'my compliments', 'food was tasty and buffet facility was available', 'rooms were neat and clean', 'it was an official trip with colleagues', 'the location of the hotel was convenient', 'the basic amenities were provided and it was in working order', 'food was tasty and buffet facility was available', 'rooms were neat and clean', 'it was an official tour', 'its a seven star and equally priced', 'the overall experience was very nice', 'right from walking in to the hotel to the minute of the complementary airport drop , there was an element of service of the highest order', 'the entrance lobby was grand with running horses and flowing water , gives a feeling of horses running over water', 'it looks even majestic in the evening with light effects in the dark']","['breakfast was not spectacular', 'was there for d time during business trip', 'main entrance and roof level still not finished', 'the construction has been going on for years and is not yet completed', 'i had booked for a night online', 'i stayed at the sahara for one night when i stopped over in mumbai', 'they do provide free pickup and drop from airport', 'experience was awesome', 'the amenities were very useful', 'they did not delay in checkin and checkout procedure', 'it was valued for the money', 'i did not have any issue in checkin and checkout procedure', 'i had been there for a business trip', 'decided to spend a night on a business trip and then take an afternoon flight from the domestic airport', 'had been to jade auditorium for a couple of business seminars', 'it was proximity to the airport just adds more to its business value']",[],5.526325,1,0,1,0,0,[],['the location of the hotel was convenient'],[],[],5.68151,5,1,2,2,0,['rooms are very good and room service is also quick'],"['rooms were neat and clean', 'rooms were neat and clean']","['breakfast was not spectacular', 'the rooms are renovated , the decor is exemplary , and the best part this hotel excels is in its hospitality']",[],5.85865,3,0,3,0,0,[],"['breakfast was not spectacular', 'food was tasty and buffet facility was available', 'food was tasty and buffet facility was available']",[],[],5.4893,1,0,0,1,0,[],[],"['right from walking in to the hotel to the minute of the complementary airport drop , there was an element of service of the highest order']",[],7.2757,2,0,2,0,0,[],"['rooms were neat and clean', 'rooms were neat and clean']",[],[],125,10
The Legend,"Plot No. 53 Junction of Nehru Road, 400055, India",Plot No. 53 Junction of Nehru Road,3,"Restaurant, Room Service, Free Parking",3517,5306,6.814147115,6.131107639,36,10,14,12,0,"['recommended', 'according to my visit , the hotel was best in every field required and money spent was absolutely worth it', 'location of the restaurant is also very good', 'quality of dishes is incredible', 'this hotel is superb and all the facilities are very good', 'hotel destination is good and easy to approach', 'staff are helpful and food is very good and enough', 'checkin and checkout is good , water supply and rate is very costly', 'very good', 'excellent stay']","['charges are super premium', 'eg rs', 'i had to stay here with my family for weeks', 'i felt safe with my little children', 'its well connected to railway station , airport , bkc etc', 'hot water at all times', 'as its located', 'the staff members in the hotel were cooperative and quick in service', 'the rooms were neat and clean , wellmaintained with all the amenities , which were working perfectly', 'hotel was clean', 'rooms were clean', 'hotel is very nice and location is near by airport', 'i always stay at the the legend at santa cruz , since it is quite near to the airport', 'i just love staying there']","['most people have complained about the entrance , and frankly that was the only problem we can', 'the hotel is very near to santacruz station and bkc', 'just outside , the road is filthy', 'rooms , bedsheets , towels etc were very clean and i had no', 'pleasant stay affordable price very close to bandra kurla complex , staff also friendly , it was my short stay but very silent sleep i took a hotel car for dropping to the international airport', 'for mineral water air condition is just a big joke', 'they sent me a car to pick my luggage', 'i had no problem with laundry or hot water', 'hotel was very near to santacruz station', 'budget hotel with complimentary breakfast', 'the room prices include buffet breakfast which is well laid out with western and indian dishes', 'hygienic worst experience nothing']",[],5.4683875,2,0,1,1,0,[],['location of the restaurant is also very good'],['hotel is very nice and location is near by airport'],[],5.790261111,9,2,3,4,0,"['this hotel is superb and all the facilities are very good', 'hotel destination is good and easy to approach']","['rooms , bedsheets , towels etc were very clean and i had no', 'the rooms were neat and clean , wellmaintained with all the amenities , which were working perfectly', 'rooms were clean']","['the hotel is very near to santacruz station and bkc', 'according to my visit , the hotel was best in every field required and money spent was absolutely worth it', 'hotel was very near to santacruz station', 'the room prices include buffet breakfast which is well laid out with western and indian dishes']",[],6.1998625,4,1,2,1,0,['staff are helpful and food is very good and enough'],"['budget hotel with complimentary breakfast', 'location of the restaurant is also very good']",['the room prices include buffet breakfast which is well laid out with western and indian dishes'],[],6.0313,3,0,3,0,0,[],"['pleasant stay affordable price very close to bandra kurla complex , staff also friendly , it was my short stay but very silent sleep i took a hotel car for dropping to the international airport', 'the staff members in the hotel were cooperative and quick in service', 'staff are helpful and food is very good and enough']",[],[],5.99766875,4,0,3,1,0,[],"['the rooms were neat and clean , wellmaintained with all the amenities , which were working perfectly', 'hotel was clean', 'rooms were clean']","['rooms , bedsheets , towels etc were very clean and i had no']",[],104,12
