Kohinoor Continental,"Andheri Kurla Road, Andheri E, 400059, India", Andheri E,3.5,"Vile Parle East, Free Breakfast, Mid-range, Pool, Pool, Restaurant, Room Service, Free Parking, Fitness Centre with Gym / Workout Room, Bar/Lounge, Free Breakfast",5244,11598,6.229486458,5.751975862,29,4,10,15,0,"['appearance and the interior of the hotel are very attractive and hygienic', 'the hotel offers airport pickup and the location is good', 'best ever is the paintings in lobby', 'even single rooms was so nice with same quality food with the great breakfast']","['ft', 'its a decent airport near international airport', 'recommended for business trips', 'ambiance was good', 'food is ok and conference room is also good', 'hospitality was good', 'room service is quite prompt and fast', 'quite decent hotel with very hospitable staff and services', 'will refer to everyone', 'i recommended all my friends']","['proximity to andheri to malad , powai and ghatkopor on central side', 'what a shameless front office manager shantanu of kohinoor continental', 'they provide free pick and drop from airport', 'traffic condition is difficult to handle', 'however , their should be more variety in the menu and taste', 'they had always been ready to help and cooperate', 'located at noisy andheri kurla road', 'it is not so long from station also we can travel by metro from andheri to chakala', 'and i didnt have any problem in checkin or checkout', 'wifi and laundry services were also available in the hotel', 'there was no delay in check in and check out procedure', 'hotel staff is very down to earth and helping', 'the hotel is bang on the metro station which was under construction when i visited', 'the same was promptly noted and was ready , early morning', 'i resided for a day in sapphire plaza suite and two days in the single']",[],5.8547125,2,1,0,1,0,['the hotel offers airport pickup and the location is good'],[],['the hotel is bang on the metro station which was under construction when i visited'],[],6.62928125,4,1,2,1,0,['appearance and the interior of the hotel are very attractive and hygienic'],"['food is ok and conference room is also good', 'even single rooms was so nice with same quality food with the great breakfast']",['room service is quite prompt and fast'],[],6.8350875,2,1,1,0,0,['even single rooms was so nice with same quality food with the great breakfast'],['food is ok and conference room is also good'],[],[],5.4360125,4,0,2,2,0,[],"['room service is quite prompt and fast', 'hotel staff is very down to earth and helping']","['wifi and laundry services were also available in the hotel', 'quite decent hotel with very hospitable staff and services']",[],NA,0,0,0,0,0,[],[],[],[],103,23
Hotel Airport International,"Opposite BIG Sangam Cinemas,Andheri Kurla Road,Andheri East, Andheri East, 400059, India", Andheri East,4,"Luxury, Pool, Free Parking, Pool, Fitness Centre with Gym / Workout Room, Room Service, Restaurant, Free Parking, Bar/Lounge, Spa",7095,12215,6.286421,5.834341346,26,5,7,14,0,"['good hotel to stay , nice swimming pool and a decent breakfast', 'but as an overall experience i can grade it very good', 'nice hotel to stay with good service', 'cleanliness is good and the rooms were nice', 'a nice , economical stay']","['location was good , just beneath the metro line in andheri e , deserves the marriott label', 'the bed and shower were of an excellent quality and all the staff were very friendly', 'hygiene should improve to make the stay more pleasant here', 'it was good overall', 'the room was neat and clean and very hygienic', 'it is worth staying here', 'sight from my window was so beautiful']","['they kindly gave me late checkout without charge and told me what kind of charges to expect if i used my own taxis which i generally do', 'there were some hiccups i informed them that they needed to pick up my sister from the airport , but they did not organise this', 'couldnt have asked for more', 'the airport pickup was the best the driver was helpful kind', 'let me list the good things first', 'the food were not very satisfactory', 'inner appearance of rooms is not bad', 'the rooms are not that clean', 'breakfast complimentary was better than expected compared to a hotel of that rating', 'airport transfers were on time', 'the problem is to get down at the entry gate', 'there is no problem in checkin and checkout', 'they even arranged us guide for city tour', 'the room and the bathroom were small and not that clean either']",[],5.5159125,2,0,1,1,0,[],"['location was good , just beneath the metro line in andheri e , deserves the marriott label']",['sight from my window was so beautiful'],[],5.368909375,8,0,3,5,0,[],"['cleanliness is good and the rooms were nice', 'inner appearance of rooms is not bad', 'the rooms are not that clean']","['the bed and shower were of an excellent quality and all the staff were very friendly', 'the food were not very satisfactory', 'the room was neat and clean and very hygienic', 'sight from my window was so beautiful', 'the room and the bathroom were small and not that clean either']",[],6.1294,3,0,3,0,0,[],"['good hotel to stay , nice swimming pool and a decent breakfast', 'the food were not very satisfactory', 'breakfast complimentary was better than expected compared to a hotel of that rating']",[],[],7.51955,2,0,2,0,0,[],"['the bed and shower were of an excellent quality and all the staff were very friendly', 'nice hotel to stay with good service']",[],[],6.430825,5,2,1,2,0,"['cleanliness is good and the rooms were nice', 'the room was neat and clean and very hygienic']","['location was good , just beneath the metro line in andheri e , deserves the marriott label']","['the rooms are not that clean', 'the room and the bathroom were small and not that clean either']",[],94,2
New Shahana,"Shop No-5, Marol Maroshi road, Andheri, 400059, India", Andheri,2.5,"Restaurant, Bar/Lounge, Room Service, Free High Speed Internet ( WiFi )",1049,1913,6.292129167,5.592251786,14,0,9,5,0,[],"['i slept in the dorm', 'location is good , staff', 'good locality with minimum facility', 'worth stay for lonely birds', 'very nearer to international airport', 'you get what you pay for', 'it had a tv , bathroom and a nice bed with air con and a fan and the staff were nice enough , they even gave us a wake up call for our airport journey', 'yes its ok', 'but otherwise its ok']","['it is in the basement , where theres no wi fi and no hot water in mumbai thats not realy a problem', 'booked through expedia', 'it could have been better provided they have put some mosquito repellent', 'that was the only problem in dormitory', 'also the should have put a better quality television for the entertainment']",[],6.44055,2,0,2,0,0,[],"['location is good , staff', 'good locality with minimum facility']",[],[],5.5239625,2,0,1,1,0,[],"['it had a tv , bathroom and a nice bed with air con and a fan and the staff were nice enough , they even gave us a wake up call for our airport journey']",['good locality with minimum facility'],[],NA,0,0,0,0,0,[],[],[],[],7.0603125,2,1,1,0,0,"['location is good , staff']","['it had a tv , bathroom and a nice bed with air con and a fan and the staff were nice enough , they even gave us a wake up call for our airport journey']",[],[],NA,0,0,0,0,0,[],[],[],[],35,52
Mirage Hotel,"Corner of International Approach Road, Next to Leela,, 400059, India",NA,4,"Room Service, Restaurant, Free Parking, Bar/Lounge, Spa, Fitness Centre with Gym / Workout Room, Free Internet",4936,7650,6.292705952,5.832221774,31,3,16,12,0,"['we greatly enjoyed our stay here', 'the mirage is a fantastic option for those transiting via the mumbai intl airport', 'rooms service is extremely good']","['if u need to be close to the airport , especially with mumbais notorious traffic , this is ideal', 'theres this guy nimphal at', 'everyone was extremely helpful and kind to us', 'i would strongly recommend it', 'great location we went also during festival time and were able to see the action from our room , which was nice', 'we had a', 'have stayed here multiple times', 'the rooms are huge and the breakfast is decent', 'the rooms were large and well maintained with all the amenities provided by the hotel was in proper condition', 'actually i was on a business tour and i stayed at this hotel for couple of days', 'overall experience was pleasant', 'hotel was very good , staff was courteous', 'overall experience outstanding', 'but their hospitality was nice', 'the rooms were excellent but i would have to say it was slightly over priced for the services that it offered', 'ideally located near the airport']","['there was some noise from the road outside , but nothing to prevent a good nights sleep', 'to get a simcard in mumbai is a nightmare because it', 'only positive is its close to the airport', 'there was a desk , chair , armchair , pouffe , fridge , safe , tea and coffee , tv etc', 'i went to mumbai to meet my fiance', 'they said she wouldnt even be able to meet me as a visitor and spoke to me like she was a prostitute', 'its hardly mins away from the airport', 'i arrived from seoul at hrs , they had the car waiting for me at the airport , my check in was fast and i was ushered', 'also the same is located a few steps away from the mumbai metro station marol naka which', 'lot of options even at odd hours', 'not that pricey , but offers value for whatever it costs', 'it was official visit at mumbai']",[],7.493375,1,0,1,0,0,[],"['great location we went also during festival time and were able to see the action from our room , which was nice']",[],[],5.69695,6,0,6,0,0,[],"['great location we went also during festival time and were able to see the action from our room , which was nice', 'rooms service is extremely good', 'the rooms are huge and the breakfast is decent', 'the rooms were large and well maintained with all the amenities provided by the hotel was in proper condition', 'actually i was on a business tour and i stayed at this hotel for couple of days', 'the rooms were excellent but i would have to say it was slightly over priced for the services that it offered']",[],[],7.32735,1,0,1,0,0,[],['the rooms are huge and the breakfast is decent'],[],[],6.395991667,3,0,3,0,0,[],"['rooms service is extremely good', 'hotel was very good , staff was courteous', 'the rooms were excellent but i would have to say it was slightly over priced for the services that it offered']",[],[],NA,0,0,0,0,0,[],[],[],[],73,26
Hotel Adore Inn,"Gomes Compound, 90 Feet Road, Andheri East, Opposite Peninsula Grand, Near Holiday Inn Hotel, India", Opposite Peninsula Grand,3,,1851,2406,6.313851923,5.553127885,26,3,6,17,0,"['the service of this hotel is superb', 'the staff is very good , location is near airport so it is good', 'this hotel is something special the architecture and building is amazing in itself but the overall management and service is something else']","['i would recommend to everyone', 'the rooms are clean and', 'i was never able to connect to the internet', 'we were told that', 'if possible he provided early check in', 'very welcoming and friendly as well as helpful as i wanted to arrange a few trips i was assisted very well']","['its only suitable for couple', 'not more than that', 'i have visit in mumbai in', 'which was really annoying', 'its cheap that way', 'make sure you check the price online and speak through the phone before check in or else they ask extra bucks', 'complimentary a sample soap and', 'i was in my business tour', 'i used to come in mumbai often', 'for a city like mumbai , the rate was an unbelievable one', 'nagpur at pm and my connecting flight was at am', 'the meru taxi charges rupees', 'the hotel tariff for a night stay with breakfast is', 'we booked online through booking', 'com who we have used before and had a reference number', 'they then told us we had no booking and that they were full', 'its like clockwork']",[],8.684525,1,1,0,0,0,"['the staff is very good , location is near airport so it is good']",[],[],[],5.518325,1,0,1,0,0,[],['the rooms are clean and'],[],[],5.464225,1,0,0,1,0,[],[],['the hotel tariff for a night stay with breakfast is'],[],6.652,3,1,2,0,0,['this hotel is something special the architecture and building is amazing in itself but the overall management and service is something else'],"['the service of this hotel is superb', 'the staff is very good , location is near airport so it is good']",[],[],6.4955,1,0,1,0,0,[],['the rooms are clean and'],[],[],74,8
Hotel Suncity Residency,"16th Road, MIDC, Marol, Andheri East, 400093, India", Andheri East,3.5,"Restaurant, Room Service, Free Parking, Bar/Lounge, Free Breakfast, Free High Speed Internet ( WiFi )",4380,6169,6.322986538,5.921395833,36,5,17,14,0,"['the hotel is located in a good area , with other good eateries nearby', 'welcoming , professional and made me feel instantly at ease and relaxed', 'keep up the good work guys', 'the property is neat and clean and well maintained', 'well location of hotel is very good']","['located near to the airport , this one takes good care of you', 'they have airport pick up', 'very clean , the bathrooms are thoughtfully designed', 'the rooms are adequately sized by mumbai business hotel standards', 'high points', 'people who work there are friendly and they can easily manage for you a car to airport and from the airport', 'i wished i been able to stay longer to relax in the warm hospitality of the team', 'as we', 'the rooms were ok in size , but clean overall', 'it was a comfortable stay', 'overall , it was very good stay but not excellent', 'amenities were in good condition', 'it was great value for money', 'it looks good both outside and in', 'smooth checkin and checkout', 'the front office isnt as prompt and they should improve this', 'i had come to attend a meeting along with my wife']","['if you wish they can also arrange an', 'we started panicking as were expecting our guests to arrive any moment', 'the lift was very small and slightly claustrophobic', 'the location was a bit difficult to reach as it is not on a main road and my friend who was local to', 'checked in for a short stay', 'when i complained , they immediately sent technician', 'the washroom was kept clean', 'there was no delay in checkin and checkout', 'all amenities provided worked well', 'no special view from the room', 'there was no delay in checkin and checkout procedure', 'hotel pickup was complimentary for us as well as the breakfast', 'their weekend discounts are also very lucrative', 'travelling is a problem here , as it is not in the city center']",[],6.03424,5,1,3,1,0,"['the hotel is located in a good area , with other good eateries nearby']","['the property is neat and clean and well maintained', 'the location was a bit difficult to reach as it is not on a main road and my friend who was local to', 'well location of hotel is very good']",['no special view from the room'],[],5.1711625,6,0,2,4,0,[],"['the rooms are adequately sized by mumbai business hotel standards', 'the washroom was kept clean']","['very clean , the bathrooms are thoughtfully designed', 'the rooms were ok in size , but clean overall', 'the location was a bit difficult to reach as it is not on a main road and my friend who was local to', 'no special view from the room']",[],5.573125,1,0,1,0,0,[],['hotel pickup was complimentary for us as well as the breakfast'],[],[],NA,0,0,0,0,0,[],[],[],[],6.773725,4,1,3,0,0,['the property is neat and clean and well maintained'],"['very clean , the bathrooms are thoughtfully designed', 'the rooms were ok in size , but clean overall', 'the washroom was kept clean']",[],[],126,20
Landmark Suites,NA,NA,NA,,NA,NA,6.34726875,5.652853571,7,0,4,3,0,[],"['room was neat and clean', 'location wise hotel was okay', 'it was my official trip', 'checkin and checkout procedure was easy']","['not at all recommendable for holidays', 'activities were missing in the hotel', 'pickup and drop facility was not given by the hotel']",[],5.543975,1,0,1,0,0,[],['location wise hotel was okay'],[],[],5.375658333,3,0,1,2,0,[],['activities were missing in the hotel'],"['room was neat and clean', 'pickup and drop facility was not given by the hotel']",[],NA,0,0,0,0,0,[],[],[],[],NA,0,0,0,0,0,[],[],[],[],7.6869,1,0,1,0,0,[],['room was neat and clean'],[],[],22,84
Peninsula Grand Hotel,"Sakinaka Junction, Andheri (E), 400072, India", Andheri (E),4,"Luxury, Free Parking, Restaurant, Free Parking, Room Service, Bar/Lounge, Free Internet",5182,9254,6.356742857,5.708027941,34,4,9,21,0,"['rooms are well done , food is great', 'it was a very good experience', 'the carvings on it are beautiful', 'overall good experience']","['been stayed about a week with friends on our quick business trip to mumbai', 'the hotel is decent in this city also staffs are very', 'stayed here early december whilst attending a wedding there , fortunately only for two nights', 'the rooms are good and clean', 'checkout the next day was conducted efficiently and transport', 'location wise , hotel was average', 'washroom was also neat and clean', 'as well as the surrounding are great epitomes of ancient architectural excellence', 'appearance was good']","['had the privilege of staying here at short notice', 'very accommodating manager and staff', 'also not forgetting the', 'the only criticism i can do would be to more attention to detail', 'i ordered for a single malt with ice separate , what i got was', 'stayed here on a company conference in the month of nov for a night', 'i only spent a night there but it was good one', 'the location of the hotel was not good', 'there was no delay in check in and check out procedure', 'staff at the hotel was helpful', 'they provided quick response to our requests', 'i am mostly a business traveller', 'its centrally air conditioned all through with mostly carpeted', 'though there is nothing for fitness like a gymnasium', 'must visit for everyone', 'we have stayed here while returning to guwahati', 'we have asked them for a car at pm in the night and they arranged it in minutes', 'i only spent a night there but it was good one', 'it was near the bus stand', 'no delay in check in and check out', 'did not inquire about the travel desk']",[],6.2735,2,0,2,0,0,[],"['location wise , hotel was average', 'the location of the hotel was not good']",[],[],5.56775,4,0,4,0,0,[],"['very accommodating manager and staff', 'the rooms are good and clean', 'rooms are well done , food is great', 'washroom was also neat and clean']",[],[],8.4888,1,1,0,0,0,"['rooms are well done , food is great']",[],[],[],6.043,3,0,3,0,0,[],"['the hotel is decent in this city also staffs are very', 'very accommodating manager and staff', 'staff at the hotel was helpful']",[],[],7.800575,2,2,0,0,0,"['the rooms are good and clean', 'washroom was also neat and clean']",[],[],[],129,14
Hotel Suba International,"Plot Number 211, 400099, India",Plot Number 211,4,"Restaurant, Room Service, Free Parking, Free High Speed Internet ( WiFi )",4565,6848,6.358278571,5.655534302,43,2,21,20,0,"['what a phenomenal experience', 'rooms are neat and tidy with good ambiance']","['very luxurious stay', 'best part is all under one roof to organise', 'probably the best i stayed at within india', 'free airport transfers', 'once inside the hotel , everything was good staff was professional and good prompt service', 'we were there for only one night and had a comfortable stay', 'an airport shuttle is good', 'next', 'stayed overnight while in transit', 'picked us up atvthe airport passed midnight', 'rooms were neat , clean , and wellmaintained', 'wash rooms are big , nice and clean', 'i love the kebabs', 'they have basements and floors above', 'however , the metro line operational , it is a good bet', 'this trip was organized through my company', 'microwave and refrigerator were also there', 'i have stayed here for times', 'food offered in hotel are tasty', 'maintenance is good and hygienic', 'they have made good use of the technology']","['i would continue staying here everytime i visit', 'it was tough for me find faults', 'did not even checkin with my fiance because of their nomanwomanstayingtogether policy', 'they should definitely consider removing the word international from their name', 'they even agreed that i pay my bill at time of departure , and did not press me for either an advance deposit or my credit card details', 'only downsides were', 'in short everything to make', 'arrived very late in night at am or early hours of morning', 'we were having only few hours to relax as our next domestic connection at am', 'check in in mins', 'the only shortcoming was the hot water , which was not as hot as i would like but then , i need scalding water to be happy', 'proximity to airport is added advantage , though there front desk needs improvement as checkout takes time', 'services were satisfactory', 'i stayed there for couple of days as i was in mumbai for a family get together', 'it is nearby station and airport', 'i stayed there for days', 'it is located little far from airport', 'basic amenities as tv , geyser , etc', 'were available', 'hotel staff is supportive']",[],NA,0,0,0,0,0,[],[],[],[],5.51251875,4,0,3,1,0,[],"['services were satisfactory', 'rooms were neat , clean , and wellmaintained', 'rooms are neat and tidy with good ambiance']","['wash rooms are big , nice and clean']",[],5.5,1,0,1,0,0,[],['food offered in hotel are tasty'],[],[],6.110125,3,0,2,1,0,[],"['once inside the hotel , everything was good staff was professional and good prompt service', 'hotel staff is supportive']",['services were satisfactory'],[],7.795641667,3,2,1,0,0,"['wash rooms are big , nice and clean', 'rooms are neat and tidy with good ambiance']","['rooms were neat , clean , and wellmaintained']",[],[],119,21
Ace Residency,"Opp. N.G. Complex Near Ashok Nagar Marol, Military Road, Andheri East, 400072, India", Andheri East,2,"Room Service, Free Parking, Free High Speed Internet ( WiFi )",1666,2468,6.369045,5.766236806,36,6,13,14,3,"['i promise everyone will enjoy the trip and it will be memorable too', 'i will stay again here and will recommend my friends', 'very good hotel in my point of view and i really feel very good here', 'overall , a wholesome experience', 'so friends please go for it if you want', 'the service in this hotel was really good and satisfying']","['this all happen in the night pm', 'towels', 'the best thing is free airport transfer up and down', 'they will come to airport with name cards to receive', 'nice stay', 'good for transit passengers', 'well connected to both international as well as domestic airport of mumbai', 'you need to go walking', 'rooms were clean', 'wifi connection needs to be improved', 'quality and quantitywise are reasonably priced too', 'the tea was good', 'service in the hotel was awesome']","['when i ask where is your manager the have given me his no', 'i asked me to call myself', 'used the gpsmaps and even then had to ask for directions as its located quite inside', 'excellent staff , top service , good bed , very bad bathrooms , toilets are very bad', 'all things to be changed because its old and wornout', 'very cheap price', 'employees were very cordial and supportive', 'rooms were smelly and not at all clean', 'the restaurant is not inside the hotel', 'near to airport and transport was on time', 'had spent five days here', 'had spent five days here', 'though there was some issue with the hot water it took a lot more than expected time to get hot water', 'not what you want if you are in a rush in the morning']","['very bad experience', 'room service very bad', 'do not waste you money']",5.574475,1,0,1,0,0,[],['very good hotel in my point of view and i really feel very good here'],[],[],5.9067,4,0,3,1,0,[],"['excellent staff , top service , good bed , very bad bathrooms , toilets are very bad', 'rooms were smelly and not at all clean', 'rooms were clean']",['room service very bad'],[],5.568075,1,0,1,0,0,[],['the restaurant is not inside the hotel'],[],[],6.32861875,4,1,3,0,0,"['excellent staff , top service , good bed , very bad bathrooms , toilets are very bad']","['room service very bad', 'service in the hotel was awesome', 'the service in this hotel was really good and satisfying']",[],[],5.2103625,2,0,1,1,0,[],['rooms were clean'],['rooms were smelly and not at all clean'],[],98,47
